{
  "schema_version": 1,
  "device_id": "community_two_button",
  "source_id": "ble.community",
  "label": "Community two-button controller",
  "match": {
    "advertised_names": ["Community Controller"]
  },
  "service_uuid": "2cad0001-6e64-0146-b139-9cf2a4cd57fc",
  "motion_characteristic": "2cad0002-6e64-0146-b139-9cf2a4cd57fc",
  "input_characteristic": "2cad0003-6e64-0146-b139-9cf2a4cd57fc",
  "controls": [
    {"id": "button.primary", "label": "Primary", "bit": 0, "kind": "button"},
    {"id": "button.secondary", "label": "Secondary", "bit": 1, "kind": "button"}
  ],
  "metadata": {
    "protocol_version": 1,
    "hardware_role": "community_example"
  }
}
